{
  "version": "capacity-v1",
  "target": {
    "os": "linux",
    "arch": "amd64"
  },
  "dataset": {
    "id": "reference-2m",
    "hot_events": 1946550,
    "archive_events": 89190,
    "failure_rate": 0.041818,
    "seed": 20260806,
    "hot_days": 90,
    "archive_days": 7,
    "benchmark_now": "2026-08-06T16:00:00+08:00",
    "cardinality": {
      "identities": 323,
      "models": 52,
      "api_keys": 27
    }
  },
  "traffic_tiers": [
    {"name": "high", "key_share": 0.30, "per_key_weight": 10},
    {"name": "medium", "key_share": 0.50, "per_key_weight": 3},
    {"name": "low", "key_share": 0.20, "per_key_weight": 1}
  ],
  "resources": [
    {"id": "1c-unlimited", "cpu": 1, "memory_mib": 0},
    {"id": "2c-unlimited", "cpu": 2, "memory_mib": 0},
    {"id": "4c-unlimited", "cpu": 4, "memory_mib": 0}
  ],
  "search": {
    "rates_per_second": [25, 50, 75, 100, 150, 200, 225, 250, 275, 300, 400, 500, 600, 650, 675, 750, 900, 1000, 1250, 1500, 1750, 2000, 2500, 3000, 3500, 4000, 5000, 6000, 7500, 10000],
    "probe_seconds": 20,
    "boundary_seconds": 30,
    "boundary_repetitions": 1,
    "skip_boundary": true,
    "soak_seconds": 300,
    "max_run_seconds": 7200,
    "dashboard_core_p95_ms": 0,
    "dashboard_overall_p99_ms": 3000,
    "dashboard_requests_per_second": 1,
    "search_dashboard_capacity": true,
    "recommended_capacity_ratio": 0.70
  }
}
